{
  "$schema": "./private-estates.map-geometry.schema.json",
  "schemaVersion": 1,
  "registryVersion": "surrey-private-estates-2026-07-22-corrected-6",
  "sourceRegistrySha256": "8686da82cc41c20c4913a0fd3ec8bd4e4a5e9647e5c7babf3c41ed3f4257b651",
  "geometryVersion": "surrey-private-estates-geometry-2026-07-22-navigation-only",
  "asOf": "2026-07-22",
  "status": "installed_navigation_anchors_only",
  "crs": "OGC:CRS84",
  "coordinateOrder": "longitude_latitude",
  "purpose": "Source geometry for installed estate navigation anchors and internal location research. The product does not render estate perimeters.",
  "accuracyNotice": "A navigation label point is a cartographic anchor, not evidence of legal extent. Estate boundary geometry is not part of the installed product contract.",
  "sourceRefs": {
    "coordinate-audit-2026-07-18": {
      "type": "cross_source_coordinate_audit",
      "title": "INSIGHT Surrey private-estate display-anchor audit",
      "publisher": "INSIGHT research",
      "accessedAt": "2026-07-18",
      "reuseStatus": "research_candidate_only",
      "notes": "Coordinates were reconciled from named-place, postcode and estate-map evidence. Each remains candidate until tied to a frozen source record and reviewed on an included road/property or approved polygon."
    },
    "postcodes-io-2026-07-18": {
      "type": "postcode_centroid_api",
      "title": "Postcodes.io",
      "publisher": "Ideal Postcodes / Ordnance Survey derived open data",
      "accessedAt": "2026-07-18",
      "url": "https://postcodes.io/",
      "reuseStatus": "candidate_geocoding_only",
      "notes": "A postcode centroid is not a parcel or estate centroid."
    },
    "wentworth-official-map": {
      "type": "official_estate_map",
      "title": "Wentworth Estate map",
      "publisher": "Wentworth Estate Roads Committee",
      "accessedAt": "2026-07-18",
      "url": "https://www.wentworthestate.org.uk/copy-of-information-for-residents"
    },
    "st-georges-estate-act": {
      "type": "estate_act_without_deposited_plan",
      "title": "St George's Hill Estate Act 1990",
      "publisher": "UK Local Act",
      "accessedAt": "2026-07-18",
      "url": "https://upload.wikimedia.org/wikipedia/commons/c/c5/St._George%27s_Hill%2C_Weybridge%2C_Estate_Act_1990_%28UKLA_1990-1%29.pdf"
    },
    "burwood-official-map": {
      "type": "official_estate_map",
      "title": "Burwood Park map",
      "publisher": "Burwood Park Residents Limited",
      "accessedAt": "2026-07-18",
      "url": "https://burwoodpark.co.uk/map"
    },
    "ashley-official-map": {
      "type": "official_estate_map",
      "title": "Ashley Park estate map",
      "publisher": "Ashley Park Residents Association",
      "accessedAt": "2026-07-18",
      "url": "https://www.apraltd.com/uploads/8/2/8/2/82821254/ashley_park_estate_map.pdf"
    },
    "weybridge-park-official-map": {
      "type": "official_estate_map",
      "title": "Weybridge Park location map",
      "publisher": "Weybridge Park Estate Limited",
      "accessedAt": "2026-07-18",
      "url": "https://www.weybridgepark.com/location-map-2"
    },
    "givons-official-map": {
      "type": "official_estate_map",
      "title": "Givons Grove map of estate and houses",
      "publisher": "Givons Grove Estate Limited",
      "accessedAt": "2026-07-18",
      "url": "https://www.givonsgrove.com/map-of-the-estate-houses/"
    },
    "manygate-council-map": {
      "type": "council_conservation_area_map",
      "title": "Manygate Lane Estate conservation area map",
      "publisher": "Spelthorne Borough Council",
      "accessedAt": "2026-07-18",
      "url": "https://www.spelthorne.gov.uk/sites/default/files/migration/media/1846/Manygate-Lane-Estate-conservation-area-map/pdf/ManygateLaneEstateCAA_29January2025_Copy.pdf"
    },
    "dormans-roads-trust-map": {
      "type": "official_roads_trust_map",
      "title": "Dormans Park map",
      "publisher": "Dormans Park Roads Trust",
      "documentDate": "2020-07",
      "accessedAt": "2026-07-18",
      "url": "https://dormanspark.co.uk/wp-content/uploads/2021/11/Dormans-Park-map-2020-hi-res-WEB.pdf"
    },
    "crown-elmbridge-character-guide": {
      "type": "council_character_area_map",
      "title": "Companion Guide: Cobham, Oxshott, Stoke D'Abernon & Downside",
      "publisher": "Elmbridge Borough Council",
      "accessedAt": "2026-07-22",
      "url": "https://elmbridge.gov.uk/sites/default/files/2023-03/Companion%20guide%20-%20Cobham%20Oxshott%20Stoke%20dAbernon%20and%20Downside.pdf",
      "reuseStatus": "navigation_context_only",
      "notes": "COS10 identifies Birds Hill as a private estate inside the wider Crown Estate / Bevendean planning area; the character-area outline is not installed as a legal boundary."
    },
    "crown-road-centreline-audit-2026-07-22": {
      "type": "cross_source_road_centroid_audit",
      "title": "INSIGHT Crown Estate private-road navigation audit",
      "publisher": "INSIGHT research",
      "accessedAt": "2026-07-22",
      "reuseStatus": "navigation_only",
      "notes": "The fixed point was checked against the included Birds Hill private-road network. It is not a boundary or legal centroid."
    },
    "existing-app-seed": {
      "type": "legacy_unverified_app_coordinate",
      "title": "Current INSIGHT estate pin seed",
      "publisher": "INSIGHT",
      "accessedAt": "2026-07-18",
      "reuseStatus": "do_not_install_without_new_provenance"
    }
  },
  "pinPolicy": {
    "approvedAnchorBasis": [
      "inside_authoritative_boundary",
      "verified_internal_address",
      "verified_internal_road"
    ],
    "candidateOnlyAnchorBasis": [
      "official_map_named_feature",
      "postcode_centroid",
      "postcode_cluster_centroid",
      "named_locality_centroid",
      "legacy_app_seed"
    ],
    "rules": [
      "Pins are fixed by geographyVersion and never recomputed from transactions.",
      "A candidate point must not be described as a legal, parcel or estate centroid.",
      "Before approval, freeze coordinate provenance and verify the point on an included road/property or inside an approved display boundary.",
      "Changing an approved point requires a geographyVersion bump and review record.",
      "Held, reclassified and excluded entities cannot receive a live private-estate pin."
    ]
  },
  "boundaryPolicy": {
    "geometryStatusEnum": [
      "authoritative_georeferenced",
      "official_map_needs_georeferencing",
      "authoritative_plan_not_obtained",
      "road_schedule_only",
      "title_or_member_allowlist_required",
      "historic_context_only",
      "no_boundary_evidence",
      "excluded"
    ],
    "rules": [
      "DisplayBoundary and classificationGeometry require independent provenance and approval.",
      "Never derive a boundary from a pin, postcode centroid, transaction hull, road-centreline buffer or estate-agent map.",
      "A georeferenced plan records at least four well-distributed control points, transform, residuals, source scale, operator and peer reviewer.",
      "Polygon and MultiPolygon only; validate closed rings, topology, Surrey containment, label-point containment and every edge against the source plan.",
      "Boundary records remain research evidence only and are not rendered or used for classification."
    ]
  },
  "approvalSummary": {
    "registryEntityCount": 71,
    "productionCandidateRecordCount": 24,
    "productionCandidateWithLabelPointCount": 24,
    "candidateLabelPointCount": 56,
    "approvedLabelPointCount": 0,
    "authoritativeGeoreferencedBoundaryCount": 0,
    "notes": "Every ready/partial-ready estate has a navigation anchor. These anchors are installed for map interaction only; no candidate point implies a legal boundary."
  },
  "entities": [
    {
      "estateId": "wentworth-estate",
      "registryDisposition": "partial_ready",
      "labelPoint": {"geometry": {"type": "Point", "coordinates": [-0.57245, 51.40269]}, "readiness": "candidate", "anchorBasis": "named_locality_centroid", "derivation": {"method": "geocoder_cross_check", "provider": "named-place sources"}, "sourceRefs": ["coordinate-audit-2026-07-18", "wentworth-official-map"], "validation": {"onVerifiedIncludedFeature": null, "insideApprovedDisplayBoundary": null}, "approvedForInstall": false},
      "entrances": {"primary": null, "secondary": [], "notes": "No single main gate; official evidence describes generally unbarriered private roads."},
      "displayBoundary": {"geometryStatus": "official_map_needs_georeferencing", "geometry": null, "sourceRefs": ["wentworth-official-map"], "reviewStatus": "not_started"},
      "classificationGeometry": {"geometryStatus": "title_or_member_allowlist_required", "geometry": null, "sourceRefs": [], "reviewStatus": "not_started"},
      "blockers": ["Georeference and edge-review the official map; reconcile title-controlled boundary-road properties."]
    },
    {
      "estateId": "st-georges-hill",
      "registryDisposition": "partial_ready",
      "labelPoint": {"geometry": {"type": "Point", "coordinates": [-0.44301, 51.34997]}, "readiness": "candidate", "anchorBasis": "named_locality_centroid", "derivation": {"method": "geocoder_cross_check", "provider": "named-place sources"}, "sourceRefs": ["coordinate-audit-2026-07-18", "st-georges-estate-act"], "validation": {"onVerifiedIncludedFeature": null, "insideApprovedDisplayBoundary": null}, "approvedForInstall": false},
      "entrances": {"primary": {"entranceId": "old-avenue", "role": "primary_vehicular", "accessType": "gated", "geometry": {"type": "Point", "coordinates": [-0.43923, 51.35396]}, "readiness": "candidate", "validation": {"boundaryRelation": "unchecked"}}, "secondary": [{"entranceId": "brooklands-road", "role": "vehicular", "accessType": "gated", "geometry": {"type": "Point", "coordinates": [-0.45756, 51.35396]}, "readiness": "candidate_postcode_approximation"}]},